{
  "$schema": "../../../../schemas/research/r0.02/state-and-time-ownership.schema.json",
  "data": {
    "state_and_time": {
      "state_records": [
        {
          "authority": "AUTHORITATIVE",
          "carries_source_provenance": true,
          "mutability": "IMMUTABLE_DATA",
          "owner_scope": "serialized document",
          "reentrancy": "UNRESOLVED unless explicitly serialized; fresh React roots do not neutralize module-global state",
          "representation": "Cinema payload",
          "shared": false,
          "source_refs": [
            "S-CINEMA-TYPES"
          ],
          "state_id": "ST-CINEMA",
          "survives_frame_evaluation": true,
          "thread_safe": false
        },
        {
          "authority": "TRANSIENT",
          "carries_source_provenance": false,
          "mutability": "PER_FRAME_REBUILT",
          "owner_scope": "one requested frame",
          "reentrancy": "UNRESOLVED unless explicitly serialized; fresh React roots do not neutralize module-global state",
          "representation": "React element evaluation",
          "shared": false,
          "source_refs": [
            "S-REACT-LOWER"
          ],
          "state_id": "ST-REACT",
          "survives_frame_evaluation": false,
          "thread_safe": false
        },
        {
          "authority": "TRANSIENT",
          "carries_source_provenance": false,
          "mutability": "GLOBAL_MUTABLE",
          "owner_scope": "process/module",
          "reentrancy": "UNRESOLVED unless explicitly serialized; fresh React roots do not neutralize module-global state",
          "representation": "module-level activeFrameState and activeDof",
          "shared": true,
          "source_refs": [
            "S-REACT-LOWER"
          ],
          "state_id": "ST-ACTIVE",
          "survives_frame_evaluation": false,
          "thread_safe": false
        },
        {
          "authority": "TRANSIENT",
          "carries_source_provenance": false,
          "mutability": "MUTABLE_TREE",
          "owner_scope": "one reconciliation",
          "reentrancy": "UNRESOLVED unless explicitly serialized; fresh React roots do not neutralize module-global state",
          "representation": "HostNode tree",
          "shared": false,
          "source_refs": [
            "S-REACT-HOST"
          ],
          "state_id": "ST-HOST",
          "survives_frame_evaluation": false,
          "thread_safe": false
        },
        {
          "authority": "AUTHORITATIVE",
          "carries_source_provenance": false,
          "mutability": "IMMUTABLE_DATA",
          "owner_scope": "frame/document",
          "reentrancy": "UNRESOLVED unless explicitly serialized; fresh React roots do not neutralize module-global state",
          "representation": "Scene snapshot",
          "shared": true,
          "source_refs": [
            "S-SCENE"
          ],
          "state_id": "ST-SCENE",
          "survives_frame_evaluation": true,
          "thread_safe": true
        },
        {
          "authority": "AUTHORITATIVE",
          "carries_source_provenance": false,
          "mutability": "IMMUTABLE_DATA",
          "owner_scope": "document",
          "reentrancy": "UNRESOLVED unless explicitly serialized; fresh React roots do not neutralize module-global state",
          "representation": "Rust Timeline",
          "shared": true,
          "source_refs": [
            "S-ANIMATION"
          ],
          "state_id": "ST-TIMELINE",
          "survives_frame_evaluation": true,
          "thread_safe": true
        },
        {
          "authority": "DERIVED",
          "carries_source_provenance": false,
          "mutability": "CLONED_AND_MUTATED",
          "owner_scope": "prepass",
          "reentrancy": "UNRESOLVED unless explicitly serialized; fresh React roots do not neutralize module-global state",
          "representation": "layout-resolved Scene",
          "shared": false,
          "source_refs": [
            "S-LAYOUT"
          ],
          "state_id": "ST-LAYOUT",
          "survives_frame_evaluation": true,
          "thread_safe": false
        },
        {
          "authority": "CACHE",
          "carries_source_provenance": false,
          "mutability": "CACHE_MUTABLE",
          "owner_scope": "prepass/cache",
          "reentrancy": "UNRESOLVED unless explicitly serialized; fresh React roots do not neutralize module-global state",
          "representation": "image-resolved Scene",
          "shared": true,
          "source_refs": [
            "S-IMAGE"
          ],
          "state_id": "ST-IMAGE",
          "survives_frame_evaluation": true,
          "thread_safe": false
        },
        {
          "authority": "PRESENTATION_ONLY",
          "carries_source_provenance": false,
          "mutability": "INSTANCE_MUTABLE",
          "owner_scope": "component instance",
          "reentrancy": "UNRESOLVED unless explicitly serialized; fresh React roots do not neutralize module-global state",
          "representation": "player transport",
          "shared": false,
          "source_refs": [
            "S-PLAYER"
          ],
          "state_id": "ST-PLAYER",
          "survives_frame_evaluation": false,
          "thread_safe": false
        },
        {
          "authority": "EXTERNAL_RUNTIME",
          "carries_source_provenance": false,
          "mutability": "GLOBAL_MUTABLE",
          "owner_scope": "browser process",
          "reentrancy": "UNRESOLVED unless explicitly serialized; fresh React roots do not neutralize module-global state",
          "representation": "GPU engine coordination",
          "shared": true,
          "source_refs": [
            "S-MANDATORY-PACKAGES-PLAYER-SRC-ENGINE-DRAWER-TS"
          ],
          "state_id": "ST-GPU",
          "survives_frame_evaluation": false,
          "thread_safe": false
        },
        {
          "authority": "EXTERNAL_RUNTIME",
          "carries_source_provenance": false,
          "mutability": "EXTERNAL_RUNTIME",
          "owner_scope": "AudioContext",
          "reentrancy": "UNRESOLVED unless explicitly serialized; fresh React roots do not neutralize module-global state",
          "representation": "audio transport",
          "shared": true,
          "source_refs": [
            "S-AUDIO",
            "S-MANDATORY-PACKAGES-PLAYER-SRC-AUDIO-TS"
          ],
          "state_id": "ST-AUDIO",
          "survives_frame_evaluation": false,
          "thread_safe": false
        },
        {
          "authority": "DERIVED",
          "carries_source_provenance": false,
          "mutability": "IMMUTABLE_DATA",
          "owner_scope": "export invocation",
          "reentrancy": "UNRESOLVED unless explicitly serialized; fresh React roots do not neutralize module-global state",
          "representation": "temporary frames JSON",
          "shared": false,
          "source_refs": [
            "S-NODE-EXPORT"
          ],
          "state_id": "ST-FRAMES",
          "survives_frame_evaluation": true,
          "thread_safe": false
        }
      ],
      "time_conversions": [
        {
          "clamping_behavior": "none established",
          "conversion_id": "TC-01",
          "fractional_time_behavior": "fraction removed",
          "negative_time_behavior": "negative values possible before validation",
          "operation": "round seconds multiplied by fps",
          "owner": "Cinema timing",
          "precision_risk": "rounding changes authored timing",
          "rate_behavior": "fps multiplication",
          "rounding_behavior": "nearest integer",
          "source_domain": "SECONDS_NUMBER",
          "source_refs": [
            "S-CINEMA-TIME"
          ],
          "target_domain": "COMPOSITION_FRAME_LOCAL"
        },
        {
          "clamping_behavior": "validated by Cinema",
          "conversion_id": "TC-02",
          "fractional_time_behavior": "fraction removed",
          "negative_time_behavior": "integer frames",
          "operation": "duration and transition overlap derivation",
          "owner": "Cinema compiler",
          "precision_risk": "overlap accumulation",
          "rate_behavior": "fps-dependent",
          "rounding_behavior": "rounding from TimeSpec",
          "source_domain": "COMPOSITION_FRAME_LOCAL",
          "source_refs": [
            "S-CINEMA-TIME",
            "S-CINEMA-COMPILER"
          ],
          "target_domain": "FRAME_INDEX_INTEGER"
        },
        {
          "clamping_behavior": "inherits output-frame range",
          "conversion_id": "TC-03",
          "fractional_time_behavior": "preserved",
          "negative_time_behavior": "fractional samples introduced",
          "operation": "motion-blur sample offsets",
          "owner": "React exporter",
          "precision_risk": "floating sample precision",
          "rate_behavior": "sample-count dependent",
          "rounding_behavior": "none",
          "source_domain": "FRAME_INDEX_INTEGER",
          "source_refs": [
            "S-NODE-EXPORT",
            "S-REACT-LOWER"
          ],
          "target_domain": "FRAME_INDEX_FLOAT"
        },
        {
          "clamping_behavior": "negative behavior unresolved",
          "conversion_id": "TC-04",
          "fractional_time_behavior": "preserved",
          "negative_time_behavior": "preserved",
          "operation": "FrameContext assignment",
          "owner": "React frame evaluator",
          "precision_risk": "module-global ownership",
          "rate_behavior": "fps-independent",
          "rounding_behavior": "none",
          "source_domain": "FRAME_INDEX_FLOAT",
          "source_refs": [
            "S-REACT-FRAME",
            "S-REACT-LOWER"
          ],
          "target_domain": "COMPOSITION_FRAME_LOCAL"
        },
        {
          "clamping_behavior": "negative local frames can be outside active range",
          "conversion_id": "TC-05",
          "fractional_time_behavior": "preserved",